<!ELEMENT persoane (persoana+)>
<!ELEMENT persoana (nume, prenume, varsta, adresa?, informatii-cv?)>
<!ATTLIST persoana id ID #REQUIRED>
<!ELEMENT nume (#PCDATA)>
<!ELEMENT prenume (#PCDATA)>
<!ELEMENT varsta (#PCDATA)>
<!ELEMENT adresa (strada, numar, localitate, judet, tara)>
<!ELEMENT strada (#PCDATA)>
<!ELEMENT numar (#PCDATA)>
<!ELEMENT localitate (#PCDATA)>
<!ELEMENT judet (#PCDATA)>
<!ELEMENT tara (#PCDATA)>
<!ELEMENT informatii-cv (studii?, experienta?)>
<!ELEMENT studii (#PCDATA)>
<!ELEMENT experienta (#PCDATA)>
